{
  "feature_name": "USER-AUTH",
  "documentation_timestamp": "2025-12-19T10:30:00Z",
  "phase3_source": "results/USER-AUTH/phase3/ruletable.json",
  "enhancement_sources": [
    "security-policy-specialist: Business context for authentication and security rules",
    "Phase 1 analysis.json: Component ownership for technical stakeholders",
    "Phase 2 dependencies.puml: Process flow for stakeholder identification"
  ],

  "business_rules_enhanced": [
    {
      "_comment": "Phase 3 technical fields PRESERVED",
      "rule_id": "AUTH-BR-001",
      "rule_name": "Failed Login Lockout",
      "rule_description": "After 5 consecutive failed login attempts, user account is locked for 15 minutes",
      "rule_category": "security",
      "business_process": "User Authentication",
      "source_location": "AuthenticationManager.java:156",
      "source_type": "source_code",
      "source_evidence": "if (failedAttempts >= MAX_FAILED_ATTEMPTS) { lockAccount(userId, LOCKOUT_DURATION); }",
      "confidence_score": 5,
      "confidence_rationale": "Explicit code with named constants confirms rule",
      "business_impact": "Prevents brute-force password attacks while allowing legitimate users to regain access after timeout",
      "regulatory_context": "Aligns with NIST SP 800-63B authentication guidelines",
      "compliance_requirements": ["NIST SP 800-63B", "PCI DSS Requirement 8.1.6"],
      "implementation_notes": "Lockout counter resets on successful login. Admin can manually unlock accounts.",
      "related_rules": ["AUTH-BR-002", "AUTH-BR-003"],
      "migration_priority": "high",
      "validation_status": "user_confirmed",
      "user_feedback": "Confirmed accurate. Critical security rule.",

      "_comment": "Phase 4 business enhancements ADDED",
      "business_objective": "Prevent automated brute-force password attacks while maintaining user accessibility through temporary lockout mechanism. Balances security requirements with user experience.",
      "business_terminology": "When a user fails to log in 5 times in a row, the system temporarily blocks their account for 15 minutes to protect against automated password guessing attacks. After 15 minutes, the user can try again. This prevents hackers from trying thousands of password combinations while allowing real users to regain access quickly.",
      "stakeholder_owner": {
        "business_owner": "IT Security Department",
        "technical_owner": "Authentication Services Team",
        "decision_authority": "CISO (Chief Information Security Officer)"
      },
      "regulatory_rationale": "Implements NIST SP 800-63B Section 5.2.2 requirements for authentication rate limiting and account lockout to prevent online guessing attacks. Aligns with PCI DSS Requirement 8.1.6 for limiting repeated access attempts.",
      "enhancement_sources": {
        "business_objective": "security-policy-specialist: NIST SP 800-63B authentication security guidance",
        "stakeholder_owner": "Derived from rule category (security) mapping to IT Security Department",
        "regulatory_rationale": "security-policy-specialist: NIST SP 800-63B Section 5.2.2 and PCI DSS 8.1.6"
      }
    },
    {
      "rule_id": "AUTH-BR-002",
      "rule_name": "Failed Attempt Counter Reset",
      "rule_description": "Failed login attempt counter resets to 0 after successful login",
      "rule_category": "security",
      "business_process": "User Authentication",
      "source_location": "AuthenticationManager.java:172",
      "source_type": "source_code",
      "source_evidence": "if (authenticationSuccess) { resetFailedAttempts(userId); }",
      "confidence_score": 5,
      "confidence_rationale": "Explicit code confirms counter reset",
      "business_impact": "Prevents permanent lockout for users who occasionally mistype passwords",
      "validation_status": "user_confirmed",

      "business_objective": "Allow users who successfully authenticate to start with clean slate, preventing accumulation of old failed attempts that could lead to unnecessary lockouts",
      "business_terminology": "Once a user successfully logs in, the system forgets all previous failed login attempts. This means occasional typos or forgotten passwords won't accumulate over time and eventually lock out the user.",
      "stakeholder_owner": {
        "business_owner": "IT Security Department",
        "technical_owner": "Authentication Services Team",
        "decision_authority": "IT Security Department"
      },
      "regulatory_rationale": "Supports NIST SP 800-63B usability requirements by not penalizing users for historical failed attempts after successful authentication",
      "enhancement_sources": {
        "business_objective": "security-policy-specialist: Balance security with usability",
        "stakeholder_owner": "Derived from rule category (security)"
      }
    },
    {
      "rule_id": "AUTH-BR-005",
      "rule_name": "Password Complexity Requirements",
      "rule_description": "Passwords must be at least 8 characters and include uppercase, lowercase, number, and special character",
      "rule_category": "validation",
      "business_process": "Password Management",
      "source_location": "PasswordValidator.java:45",
      "source_type": "source_code",
      "source_evidence": "Pattern.compile(\"^(?=.*[a-z])(?=.*[A-Z])(?=.*\\\\d)(?=.*[@$!%*?&])[A-Za-z\\\\d@$!%*?&]{8,}$\")",
      "confidence_score": 5,
      "confidence_rationale": "Explicit regex pattern confirms all complexity requirements",
      "business_impact": "Enforces strong password policy to prevent easy-to-guess passwords",
      "regulatory_context": "NIST SP 800-63B password requirements",
      "compliance_requirements": ["NIST SP 800-63B", "GDPR Data Protection"],
      "validation_status": "user_confirmed",

      "business_objective": "Enforce strong password creation to protect customer accounts from compromise due to weak, easily guessable passwords. Reduces risk of account takeover and unauthorized access to sensitive customer data.",
      "business_terminology": "When creating a new password, users must include a mix of uppercase letters (A-Z), lowercase letters (a-z), numbers (0-9), and special characters (!@#$%, etc.) with a minimum length of 8 characters. This makes passwords harder to guess and protects accounts from hackers.",
      "stakeholder_owner": {
        "business_owner": "IT Security Department",
        "technical_owner": "Authentication Services Team",
        "decision_authority": "IT Security Department with Data Protection Officer approval"
      },
      "regulatory_rationale": "Implements NIST SP 800-63B Section 5.1.1 password composition requirements. Supports GDPR Article 32 requirement for appropriate technical measures to ensure data security.",
      "enhancement_sources": {
        "business_objective": "security-policy-specialist: Password strength requirements",
        "stakeholder_owner": "Derived from rule category (validation) and security context",
        "regulatory_rationale": "security-policy-specialist: NIST SP 800-63B Section 5.1.1 and GDPR Article 32"
      }
    },
    {
      "rule_id": "AUTH-BR-006",
      "rule_name": "Password Hashing with bcrypt",
      "rule_description": "Passwords must be hashed using bcrypt algorithm with cost factor 12 before database storage",
      "rule_category": "security",
      "business_process": "Password Management",
      "source_location": "PasswordHasher.java:28",
      "source_type": "source_code",
      "source_evidence": "BCrypt.hashpw(password, BCrypt.gensalt(12))",
      "confidence_score": 5,
      "confidence_rationale": "Explicit use of bcrypt library with cost factor",
      "business_impact": "Protects passwords even if database is compromised",
      "regulatory_context": "Industry best practice for password storage",
      "compliance_requirements": ["NIST SP 800-63B", "OWASP Secure Coding", "PCI DSS 8.2.1"],
      "validation_status": "user_confirmed",

      "business_objective": "Ensure customer passwords remain secure even if database is breached. One-way hashing prevents password recovery by attackers who gain database access, protecting customer accounts across all systems where they may reuse passwords.",
      "business_terminology": "The system never stores actual passwords. Instead, it converts passwords into a scrambled format (hash) using a secure algorithm that cannot be reversed. Even if someone steals the database, they cannot recover the original passwords.",
      "stakeholder_owner": {
        "business_owner": "Data Protection Officer and IT Security Department",
        "technical_owner": "Authentication Services Team",
        "decision_authority": "Data Protection Officer (DPO)"
      },
      "regulatory_rationale": "Implements NIST SP 800-63B Section 5.1.1.2 requirement for approved password hashing algorithms. Aligns with GDPR Article 32 requirement for pseudonymization and encryption of personal data. Satisfies PCI DSS Requirement 8.2.1 for rendering authentication credentials unreadable.",
      "enhancement_sources": {
        "business_objective": "security-policy-specialist: Password storage security best practices",
        "stakeholder_owner": "Data Protection Officer ownership derived from GDPR compliance requirements",
        "regulatory_rationale": "security-policy-specialist: NIST, OWASP, PCI DSS password storage standards"
      }
    },
    {
      "rule_id": "AUTH-BR-010",
      "rule_name": "Session Creation After Successful Login",
      "rule_description": "Upon successful credential validation, a new session token must be created with 30-minute expiration and stored in session database",
      "rule_category": "integration",
      "business_process": "Session Management",
      "source_location": "SessionManager.java:112",
      "source_type": "source_code",